{"asset_id":"n0_insert_hole_norm","bundle_root":"/absolute/RoboTactile/deployment/artifacts/models/n0_vtla","checkpoint_path":"/absolute/RoboTactile/deployment/artifacts/models/n0_vtla/checkpoint/model.safetensors","checkpoint_repository":"NeoteAI/n0_VTLA_insert_hole","checkpoint_revision":"73a514c015c6745a14a3efdca92f25c6cfab5eb5","checkpoint_root":"/absolute/RoboTactile/deployment/artifacts/models/n0_vtla/checkpoint","checkpoint_sha256":"0000000000000000000000000000000000000000000000000000000000000000","config_name":"sim_single_arm_tactile","config_path":"/absolute/RoboTactile/deployment/artifacts/models/n0_vtla/checkpoint/config.json","config_sha256":"0000000000000000000000000000000000000000000000000000000000000000","external_commit":"03a0ce4d7091ca2354864796770715aa212601b7","normalizer_path":"/absolute/RoboTactile/deployment/artifacts/models/n0_vtla/checkpoint/assets/n0_insert_hole_norm/norm_stats.json","normalizer_sha256":"0000000000000000000000000000000000000000000000000000000000000000","schema_version":"robotactile-n0-vtla-artifact-v1","task_id":"insert_hole"}
